<?xml version="1.0" encoding="UTF-8"?>
<xs:schema xmlns:xs="http://www.w3.org/2001/XMLSchema">
  <xs:element name="Jpet">
    <xs:complexType>
      <xs:sequence>
        <xs:element name="DashBoardTest">
          <xs:complexType>
            <xs:sequence>
              <xs:element name="verifyAvailablePets">
                <xs:complexType>
                  <xs:sequence>
                    <xs:element name="browserName" type="xs:string" />
                    <xs:element name="runmode" type="xs:string" />
                    <xs:element name="username" type="xs:string" />
                    <xs:element name="password" type="xs:string" />
                  </xs:sequence>
                </xs:complexType>
              </xs:element>
              <xs:element name="verifyAllPets">
                <xs:complexType>
                  <xs:sequence>
                    <xs:element name="browserName" type="xs:string" />
                    <xs:element name="runmode" type="xs:string" />
                    <xs:element name="username" type="xs:string" />
                    <xs:element name="password" type="xs:string" />
                  </xs:sequence>
                </xs:complexType>
              </xs:element>
            </xs:sequence>
          </xs:complexType>
        </xs:element>
        <xs:element name="HomePageTest">
          <xs:complexType>
            <xs:sequence>
              <xs:element name="VerifyHomePageTitle">
                <xs:complexType>
                  <xs:sequence>
                    <xs:element name="browserName" type="xs:string" />
                    <xs:element name="runmode" type="xs:string" />
                  </xs:sequence>
                </xs:complexType>
              </xs:element>
            </xs:sequence>
          </xs:complexType>
        </xs:element>
        <xs:element name="StoreEntryTest">
          <xs:complexType>
            <xs:sequence>
              <xs:element name="VerifySignInButtonPresence">
                <xs:complexType>
                  <xs:sequence>
                    <xs:element name="browserName" type="xs:string" />
                    <xs:element name="runmode" type="xs:string" />
                    <xs:element name="username" type="xs:string" />
                    <xs:element name="password" type="xs:string" />
                  </xs:sequence>
                </xs:complexType>
              </xs:element>
              <xs:element name="VerifyStoreEntryTitle">
                <xs:complexType>
                  <xs:sequence>
                    <xs:element name="browserName" type="xs:string" />
                    <xs:element name="runmode" type="xs:string" />
                    <xs:element name="username" type="xs:string" />
                    <xs:element name="password" type="xs:string" />
                  </xs:sequence>
                </xs:complexType>
              </xs:element>
              <xs:element name="Verifylogin">
                <xs:complexType>
                  <xs:sequence>
                    <xs:element name="browserName" type="xs:string" />
                    <xs:element name="runmode" type="xs:string" />
                    <xs:element name="username" type="xs:string" />
                    <xs:element name="password" type="xs:string" />
                  </xs:sequence>
                </xs:complexType>
              </xs:element>
            </xs:sequence>
          </xs:complexType>
        </xs:element>
      </xs:sequence>
    </xs:complexType>
  </xs:element>
</xs:schema>