<?xml version="1.0" encoding="UTF-8"?>
<Jpet xmlns:xsi="http://www.w3.org/2001/XMLSchema-instance" xsi:noNamespaceSchemaLocation="Jpetdata.xsd">
<DashBoardTest>
<verifyAvailablePets><browserName>chrome</browserName><runmode>Y</runmode><username>j2ee</username><password>j2ee</password></verifyAvailablePets>
<verifyAllPets><browserName>chrome</browserName><runmode>Y</runmode><username>j2ee</username><password>j2ee</password></verifyAllPets>
</DashBoardTest>
<HomePageTest>
<VerifyHomePageTitle><browserName>chrome</browserName><runmode>Y</runmode></VerifyHomePageTitle>
</HomePageTest>
<StoreEntryTest>
<VerifySignInButtonPresence><browserName>chrome</browserName><runmode>Y</runmode><username>j2ee</username><password>j2ee</password></VerifySignInButtonPresence>
<VerifyStoreEntryTitle><browserName>chrome</browserName><runmode>Y</runmode><username>j2ee</username><password>j2ee</password></VerifyStoreEntryTitle>
<Verifylogin><browserName>chrome</browserName><runmode>Y</runmode><username>j2ee</username><password>j2ee</password></Verifylogin></StoreEntryTest>
</Jpet>
